{
  "$schema": "https://json-schema.org/draft/2020-12/schema",
  "$id": "venthub/execution_report",
  "title": "Execution Report Artifact",
  "description": "Görev telemetri raporu. Her görev tamamlandığında üretilir ve zamanla dispatcher kararlarını optimize etmek için kanıt biriktirir. Önerilen vs kullanılan model karşılaştırması, hata sayısı, coverage değişimi gibi metrikler içerir.",
  "type": "object",
  "required": ["task_id", "task_title", "recommended_model", "actual_model", "duration_minutes", "error_count", "outcome"],
  "properties": {
    "skill": {
      "type": "string",
      "const": "execution-report"
    },
    "date": {
      "type": "string",
      "description": "ISO 8601 tarih (YYYY-MM-DD)"
    },
    "task_id": {
      "type": "string",
      "description": "Görev kimliği (örn: '009' veya 'REC-25')"
    },
    "task_title": {
      "type": "string",
      "minLength": 5,
      "description": "Görev başlığı"
    },
    "recommended_model": {
      "type": "string",
      "description": "Dispatcher/Plan tarafından önerilen model"
    },
    "actual_model": {
      "type": "string",
      "description": "Gerçekte kullanılan model. Önerilen modelden farklıysa bunun sebebi not edilmeli."
    },
    "model_match": {
      "type": "boolean",
      "description": "Önerilen ve kullanılan model aynı mı? false ise nedenini lessons_learned'da açıkla."
    },
    "duration_minutes": {
      "type": "number",
      "minimum": 0,
      "description": "Görev süresi (dakika). Tahmini olabilir."
    },
    "error_count": {
      "type": "integer",
      "minimum": 0,
      "description": "Görev sırasında karşılaşılan hata sayısı (lint, test failure, runtime error toplam)"
    },
    "retry_count": {
      "type": "integer",
      "minimum": 0,
      "description": "Yeniden deneme sayısı (bir adımın kaç kere tekrarlandığı)"
    },
    "coverage_before": {
      "type": "number",
      "minimum": 0,
      "maximum": 100,
      "description": "Görev öncesi test coverage yüzdesi"
    },
    "coverage_after": {
      "type": "number",
      "minimum": 0,
      "maximum": 100,
      "description": "Görev sonrası test coverage yüzdesi"
    },
    "tests_before": {
      "type": "integer",
      "minimum": 0,
      "description": "Görev öncesi toplam test sayısı"
    },
    "tests_after": {
      "type": "integer",
      "minimum": 0,
      "description": "Görev sonrası toplam test sayısı"
    },
    "outcome": {
      "type": "string",
      "enum": ["success", "partial", "failed", "aborted"],
      "description": "Görev sonucu. success = tüm adımlar tamamlandı. partial = bazı adımlar atlandı. failed = kritik hata nedeniyle tamamlanamadı. aborted = kullanıcı tarafından iptal edildi."
    },
    "lessons_learned": {
      "type": "string",
      "description": "Gelecek görevler için notlar (opsiyonel). Örn: 'Flash bu tip import zinciri analizinde yetersiz kaldı, Pro kullanılmalı'."
    }
  },
  "additionalProperties": false
}
